{
  "spec_version": "1.0.0",
  "catalog_name": "chanlun_108_algorithm_set",
  "default_research_only": true,
  "profit_guarantee": false,
  "algorithms": [
    {
      "id": "ALG-GEO-001",
      "name_zh": "顺序方向包含处理",
      "kind": "detector",
      "evidence_level": "FORMAL",
      "source_lessons": [62, 65],
      "depends_on": [],
      "consumes": ["raw_bar"],
      "emits": ["processed_bar", "processed_bar_revision"],
      "preconditions": ["bars_time_ordered", "price_in_integer_ticks"],
      "steps": ["determine_direction_without_future_bars", "merge_only_adjacent_containing_intervals", "repeat_sequentially", "preserve_raw_provenance"],
      "invalidation": ["source_bar_revision", "corporate_action_profile_change"],
      "forbidden_shortcuts": ["global_envelope_merge", "direction_backfill_from_future"]
    },
    {
      "id": "ALG-GEO-002",
      "name_zh": "分型检测与强弱标签",
      "kind": "detector",
      "evidence_level": "FORMAL",
      "source_lessons": [62, 77, 82],
      "depends_on": ["ALG-GEO-001"],
      "consumes": ["processed_bar"],
      "emits": ["fractal_candidate", "fractal_confirmed", "aux_fractal_strength"],
      "preconditions": ["three_consecutive_processed_bars"],
      "steps": ["test_top_or_bottom_strict_relations", "confirm_after_right_bar_closes", "optionally_label_strength"],
      "invalidation": ["processed_bar_revision", "inclusion_recalculation"],
      "forbidden_shortcuts": ["use_raw_bars_when_inclusion_exists", "strength_label_creates_buy_sell_signal"]
    },
    {
      "id": "ALG-GEO-003",
      "name_zh": "笔唯一划分与在线四状态",
      "kind": "state_machine",
      "evidence_level": "FORMAL",
      "source_lessons": [62, 69, 77, 91, 93, 106],
      "depends_on": ["ALG-GEO-002"],
      "consumes": ["fractal_candidate", "fractal_confirmed"],
      "emits": ["bi_candidate", "bi_confirmed", "bi_invalidated", "bi_state"],
      "preconditions": ["endpoint_fractals_disjoint", "independent_processed_bar_between_fractals", "alternating_selected_fractals"],
      "steps": ["reduce_same_type_fractals", "replace_higher_top_or_lower_bottom_candidate", "validate_spacing_and_range", "emit_confirmation_time_separately_from_endpoint_time"],
      "invalidation": ["more_extreme_same_type_fractal_before_completion", "upstream_revision"],
      "forbidden_shortcuts": ["lock_unconfirmed_endpoint", "apply_segment_non_extreme_exception_to_bi", "emit_standard_center_from_bi"]
    },
    {
      "id": "ALG-GEO-004",
      "name_zh": "特征序列线段划分",
      "kind": "state_machine",
      "evidence_level": "FORMAL",
      "source_lessons": [62, 65, 67, 71, 77, 78, 79, 81],
      "depends_on": ["ALG-GEO-003"],
      "consumes": ["bi_confirmed"],
      "emits": ["segment_candidate", "segment_confirmed", "segment_invalidated"],
      "preconditions": ["first_three_bi_overlap", "odd_bi_count_at_least_three"],
      "steps": ["build_feature_sequence", "resolve_feature_inclusion", "branch_on_gap", "require_reverse_feature_fractal_when_gap", "confirm_only_on_opposite_segment_break", "store_structural_endpoint_and_range_extreme_separately"],
      "invalidation": ["bi_revision", "pen_break_not_developing_into_segment_break"],
      "forbidden_shortcuts": ["pen_break_equals_segment_break", "force_segment_endpoint_to_global_extreme"]
    },
    {
      "id": "ALG-GEO-005",
      "name_zh": "标准中枢构建、延伸与升级",
      "kind": "detector",
      "evidence_level": "FORMAL",
      "source_lessons": [17, 18, 20, 33, 83, 91],
      "depends_on": ["ALG-GEO-004"],
      "consumes": ["segment_confirmed", "sublevel_movement_confirmed"],
      "emits": ["center_confirmed", "center_extended", "center_promoted", "center_terminated"],
      "preconditions": ["three_consecutive_completed_same_level_components", "component_type_not_bi"],
      "steps": ["compute_ZD_max_lows", "compute_ZG_min_highs", "accept_if_ZD_le_ZG", "freeze_core", "classify_extension_new_center_or_promotion"],
      "invalidation": ["component_revision", "mixed_level_or_component_type"],
      "forbidden_shortcuts": ["sliding_core", "three_bi_standard_center", "floating_epsilon_boundary"]
    },
    {
      "id": "ALG-GEO-006",
      "name_zh": "盘整、上涨、下跌与级别扩张分类",
      "kind": "classifier",
      "evidence_level": "FORMAL",
      "source_lessons": [17, 18, 20, 35, 36, 38, 99, 102],
      "depends_on": ["ALG-GEO-005"],
      "consumes": ["center_confirmed", "sublevel_movement_confirmed"],
      "emits": ["movement_candidate", "movement_confirmed", "movement_reclassified"],
      "preconditions": ["fixed_analysis_level", "canonical_same_level_decomposition"],
      "steps": ["one_center_is_consolidation", "two_or_more_ordered_nonoverlap_centers_is_trend", "overlapping_centers_trigger_higher_level_center", "preserve_candidate_paths_until_confirmed"],
      "invalidation": ["center_promotion", "canonical_decomposition_revision"],
      "forbidden_shortcuts": ["equate_timeframe_with_level", "choose_hindsight_best_decomposition"]
    },
    {
      "id": "ALG-SIG-001",
      "name_zh": "趋势背驰与第一类买卖点",
      "kind": "signal",
      "evidence_level": "FORMAL",
      "source_lessons": [15, 17, 21, 24, 27, 37, 43, 50],
      "depends_on": ["ALG-GEO-006"],
      "consumes": ["movement_confirmed", "force_measure", "lower_level_turn"],
      "emits": ["B1_candidate", "B1_confirmed", "S1_candidate", "S1_confirmed"],
      "preconditions": ["at_least_two_same_level_nonoverlap_centers", "final_leg_new_extreme", "comparable_a_and_c", "final_leg_completed"],
      "steps": ["validate_a_A_b_B_c_structure", "compare_force_after_structure_is_fixed", "locate_lower_level_completion", "stamp_confirmation_time"],
      "invalidation": ["no_new_extreme", "final_leg_extends", "force_not_weaker", "movement_reclassification"],
      "forbidden_shortcuts": ["MACD_alone_creates_B1_or_S1", "one_center_called_trend_divergence"]
    },
    {
      "id": "ALG-SIG-002",
      "name_zh": "盘整背驰转折",
      "kind": "signal",
      "evidence_level": "DERIVED",
      "source_lessons": [24, 27, 33, 37, 39, 47],
      "depends_on": ["ALG-GEO-005"],
      "consumes": ["center_confirmed", "comparable_oscillation_legs", "force_measure"],
      "emits": ["consolidation_divergence_bottom", "consolidation_divergence_top"],
      "preconditions": ["same_center_context", "same_direction_legs", "later_leg_completed"],
      "steps": ["compare_like_with_like", "emit_turn_candidate", "branch_return_to_center_or_third_point"],
      "invalidation": ["legs_not_comparable", "new_trend_structure_supersedes"],
      "forbidden_shortcuts": ["rename_as_standard_B1_or_S1"]
    },
    {
      "id": "ALG-SIG-003",
      "name_zh": "第二类买卖点三分支",
      "kind": "signal",
      "evidence_level": "FORMAL",
      "source_lessons": [14, 17, 21, 53, 86, 101],
      "depends_on": ["ALG-SIG-001"],
      "consumes": ["B1_or_S1_confirmed", "lower_level_movement_confirmed"],
      "emits": ["B2_confirmed", "S2_confirmed", "B2_B3_merged", "S2_S3_merged"],
      "preconditions": ["first_post_B1_or_S1_retest_sequence"],
      "steps": ["wait_first_countermove_completion", "wait_first_retest_completion", "classify_merged_weak_or_normal_variant"],
      "invalidation": ["not_first_retest", "source_first_point_invalidated"],
      "forbidden_shortcuts": ["require_B2_above_B1_in_all_cases", "emit_before_retest_completed"]
    },
    {
      "id": "ALG-SIG-004",
      "name_zh": "第三类买卖点",
      "kind": "signal",
      "evidence_level": "FORMAL",
      "source_lessons": [18, 20, 21, 49, 79, 86],
      "depends_on": ["ALG-GEO-005"],
      "consumes": ["center_confirmed", "lower_level_departure_completed", "first_lower_level_return_completed"],
      "emits": ["B3_confirmed", "S3_confirmed", "center_returned"],
      "preconditions": ["first_return_token_unconsumed"],
      "steps": ["for_up_departure_test_return_low_ge_ZG", "for_down_departure_test_return_high_le_ZD", "consume_first_return_token"],
      "invalidation": ["return_enters_center_core", "departure_not_completed", "center_revised"],
      "forbidden_shortcuts": ["strict_greater_boundary_in_standard_profile", "single_bar_touch_as_completed_return", "repeat_third_point_on_same_departure"]
    },
    {
      "id": "ALG-STR-001",
      "name_zh": "固定级别中枢五状态",
      "kind": "strategy",
      "evidence_level": "DERIVED",
      "source_lessons": [18, 20, 21, 49],
      "depends_on": ["ALG-SIG-001", "ALG-SIG-003", "ALG-SIG-004"],
      "consumes": ["center_state", "buy_sell_signal"],
      "emits": ["enter", "reduce", "hold", "exit", "wait"],
      "preconditions": ["fixed_level", "nearest_confirmed_center"],
      "steps": ["classify_inside_below_or_above", "classify_before_or_after_third_point", "apply_state_action_table"],
      "invalidation": ["level_change", "center_promotion"],
      "risk_controls": ["no_trade_when_state_unknown", "cost_filter"]
    },
    {
      "id": "ALG-STR-002",
      "name_zh": "只做第二类买点",
      "kind": "strategy",
      "evidence_level": "DERIVED",
      "source_lessons": [14, 17, 53, 86, 101],
      "depends_on": ["ALG-SIG-003"],
      "consumes": ["B2_confirmed", "lower_level_followthrough"],
      "emits": ["enter_long", "exit_long", "handoff_to_B3_trend"],
      "preconditions": ["B2_variant_accepted_by_config"],
      "steps": ["enter_after_confirmation", "exit_if_next_up_fails_new_high_or_diverges", "handoff_if_B3_and_nondivergent"],
      "invalidation": ["B2_source_revision", "risk_filter_block"],
      "risk_controls": ["weak_B2_position_cap", "next_executable_bar_only"]
    },
    {
      "id": "ALG-STR-003",
      "name_zh": "只做第三类买点",
      "kind": "strategy",
      "evidence_level": "DERIVED",
      "source_lessons": [20, 21, 49, 79, 86, 107],
      "depends_on": ["ALG-SIG-004"],
      "consumes": ["B3_confirmed", "followthrough_movement"],
      "emits": ["enter_long", "hold", "exit_long"],
      "preconditions": ["fixed_level", "first_return_consumed_once"],